Company name,Symbol
"LANZHOU MINBAI SHAREHOLDING (GROUP) CO.,LTD.",600738
http://www.chengda.com.cn,600739
"SHAN XI COKING CO.,LTD",600740
HUAYU Automotive Systems Company Limited,600741
"Changchun FAWAY Automobile Components Co., Ltd",600742
www.hy-online.com,600743
"DATANG HUAYIN ELECTRIC POWER CO.,LTD.",600744
"Wingtech Technology Co.,Ltd.",600745
JIANGSU SOPO CHEMICAL CO.LTD.,600746
"DALIAN DAFU ENTERPRISES HOLDINGS CO.,LTD",600747
"SHANGHAI INDUSTRIAL DEVELOPMENT CO.,LTD.",600748
"TIBET TOURISM CO.,LTD",600749
"JIANGZHONG PHARMACEUTICAL CO.,LTD",600750
"TIANJIN TIANHAI INVESTMENT CO., LTD.",600751
HENAN  ORIENTAL SILVER STAR INVESTMENT CO.LTD,600753
"Shanghai Jin Jiang International Hotels Development Co.,Ltd.",600754
"XIAMEN INTERNATIONAL TRADE GROUP CORP., LTD.",600755
"Inspur software  Co.,Ltd.",600756
"Changjiang Publishing & Media Co.,Ltd",600757
LIAONING HONGYANG ENERGY RESOURCE INVEST Co.Ltd.,600758
http://www.sse.com.cn,600759
AVIC SHENYANG AIRCRAFT COMPANY LIMITED,600760
"ANHUI HELI CO.,LTD.",600761
TOPCHOICE MEDICAL INVESTMENT CO.INC,600763
CEC CoreCast Corporation Limited,600764
http://www.avichm.com,600765
-,600766
"WINSAN(SHANGHAI)  MEDICAL SCIENCE AND TECHNOLOGY CO.,LTD",600767
HTTP://www.600768.com.cn,600768
"WUHAN XIANGLONG POWER INDUSTRY CO,LTD.",600769
"Jiangsu Zongyi Co.,LTD",600770
"GuangYuYuan Chinese Herbal Medicine Co., Ltd.",600771
"Tibet Urban Development and Investment Co.,LTD",600773
"WUHAN HANSHANG GROUP CO.,LTD.",600774
NANJING PANDA ELECTRONICS COMPANY LIMITED,600775
"EASTERN COMMUNICATIONS CO.,LTD.",600776
SHANDONG XINCHAO ENERGY CORPORATION LIMITED,600777
"XINJIANG YOUHAO (GROUP) CO.,LTD",600778
"SICHUAN SWELLFUN CO.,LTD",600779
TOP ENERGY COMPANY LTD.SHANXI,600780
"FUREN PHARMACEUTICAL INDUSTRIL(GROUP) CO.,COM",600781
"Xinyu Iron ?? Steel Co.,Ltd",600782
"Luxin Venture Capital Group Co., Ltd.",600783
"LUYIN INVESTMENT GROUP CO.,LTD.",600784
www.xhds.com.cn,600785
"CMST Development Co.,Ltd.",600787
"SHANDONG LUKANG PHARMACEUTICAL CO.,LTD.",600789
"ZheJiang China Light&Textile Industrial City Group Co.,Ltd.",600790
"BEH-PROPERTY CO., LTD",600791
"Yunnan Coal & Energy Co.,Ltd.",600792
"YibinpaperindustryCO.,LTD",600793
"ZHANGJIAGANG FREETRADE SCIENCE & TECHNOLOGY GROUP CO., LTD.",600794
"GD POWER DEVELOPMENT CO., LTD",600795
ZHEJIANG QIANJIANG BIOCHEMICAL COMPANY LIMITED,600796
"INSIGMA TECHNOLOGY CO.,LTD.",600797
NINGBO MARINE COMPANY LIMITED.,600798
"TIAN JIN GLOBAL MAGNETIC CARD CO.,LTD",600800
http//www.huaxincem .com,600801
http://www.fjcement.com/,600802
"ENN Ecological Holdings  Co.,LTD",600803
"DR.PENG TELECOM&MEDIA GROUP CO.,LTD.",600804
Jiangsu Yueda Investment Co.Ltd.,600805
"Shandong Tyan Home Co.,Ltd",600807
MAANSHAN IRON & STEEL COMPANY LIMITED,600808
"SHANXI XINGHUACUN FEN WINE FACTORY  CO.,LTD",600809
"SHEN MA INDUSTRY CO.,LTD",600810
ORIENT GROUP INCORPORATION,600811
NORTH CHINA PHARMACEUTICAL COMPANY. LTD,600812
"HANGZHOU JIEBAI GROUP CO., LIMITED.",600814
Xiamen XGMA Machinery Company Limited.,600815
"ANXIN TRUST CO.,LTD",600816
"XI'AN HONGSHENG TECHNOLOGY CO.,LTD.",600817
"ZHONGLU CO,.LTD.",600818
"SHANGHAI YAOHUA PILKINGTON GLASS GROUP CO,LTD.",600819
"SHANGHAI TUNNEL ENGINEERING CO.,LTD.",600820
"Tianjin Quan Ye Chang (Group) Co., Ltd",600821
"Shanghai Material Trading Co., Ltd.",600822
"Shanghai Shimao Co.,Ltd",600823
"SHANGHAI YIMIN COMMERCIAL GROUP CO., LTD.",600824
"Shanghai Xinhua Media Co., Ltd",600825
SHANGHAI LANSHENG CORPORATION,600826
"SHANGHAI BAILIAN GROUP CO., LTD.",600827
"Maoye Commercial Co.,Ltd.",600828
HPGC Renmintongtai Pharmaceutical Corporation,600829
"SUNNY LOAN TOP CO.,LTD",600830
http://www.600831.com,600831
"SHANGHAI NO.1 PHARMACY CO.,LTD.",600833
www.shtmetro.com,600834
http://www.chinasec.cn,600835
SHANGHAI JIELONG GROUP INDUSTRY CORPORATION LIMITED,600836
HAITONG Securities Company Limited,600837
"SHANGHAI JOIN BUY CO.,LTD.",600838
http://www.changhong.com,600839
SHANGHAI DIESEL ENGINE COMPANY LIMITED,600841
"Shang Gong Group Co., Ltd.",600843
"DANHUA CHEMICAL TECHNOLOGY CO., LTD.",600844
"Shanghai Baosight Software Co., Ltd.",600845
"SHANGHAI TONGJI SCIENCE & TECHNOLOGY INDUSTRIAL CO.,LTD",600846
www.cqwanli.com,600847
Shanghai Lingang Holdings Corporation Limited,600848
"SHANGHAI EAST-CHINA COMPUTER CO.,LTD",600850
"SHANGHAI HAIXIN GROUP CO., LTD.",600851
"LONGJIAN ROAD & BRIDGE CO.,LTD.",600853
"JIANGSU CHUNLAN REFRIGERATING EQUIPMENT STOCK CO.,LTD",600854
http://www.ascf.com.cn,600855
Changchun  Sinoenergy  Corporation,600856
"NINGBO ZHONGBAI CO., LTD.",600857
"INZONE GROUP CO.,LTD",600858
"WANGFUJING GROUP CO., LTD.",600859
Beijing Jingcheng Machinery Electric Company Limited,600860
www.bjcx.com.cn,600861
"Avic Aviation High-Technology  Co., Ltd.",600862
WWW.NMHDWZ.COM,600863
"HARBIN HATOU INVESTMENT CO.,LTD",600864
"BAIDA GROUP CO.,LTD",600865
"STAR LAKE BIOSCIENCE CO.,INC ZhAOQING GUANGDONG",600866
"TONGHUA DONGBAO PHARMACEUTICAL CO.,LTD.",600867
http://www.chinameiyan.com/,600868
"Far East Smarter Energy Co.,Ltd",600869
"XIAMEN OVERSEAS CHINESE ELECTRONIC CO.,LTD.",600870
SINOPEC OILFIELD SERVICE CORPORATION,600871
"JONJEE HI-TECH INDUSTRIAL & COMMERCIAL HOLDING CO.,LTD",600872
http://www.meihuagrp.com,600873
Tianjin Capital Environmental Protection Group Company Limited,600874
http://www.dec-ltd.cn/,600875
LUOYANG GLASS COMPANY LIMITED,600876
http://www.jialing.com.cn,600877
"China Aerospace Times Electronics CO., LTD.",600879
"Chengdu B-ray Media Co.,Ltd",600880
"JILIN YATAI (GROUP) CO., LTD.",600881
"Shanghai Ground Food Tech Co., Ltd.",600882
"Yunnan Bowin Technology&Industry Co.,Ltd.",600883
"NINGBO SHANSHAN CO.,LTD.",600884
Hongfa Technology Co.??Ltd.,600885
"SDIC Power Holdings Co.,Ltd.",600886
"INNER MONGOLIA YILI INDUSTRIAL GROUP CO.,LTD",600887
"XINJIANG JOINWORLD CO.,LTD.",600888
NANJING CHEMICAL FIBRE CO.LTD,600889
"CRED HOLDING CO.,LTD",600890
"HARBIN CHURIN GROUP JOINTSTOCK CO.,LTD.",600891
"DASHENG TIMES CULTURAL INVESTMENT CO.,LTD.",600892
"AECC AVIATION POWER CO,LTD",600893
"GUANGZHOU GUANGRI STOCK CO.,LTD.",600894
"SHANGHAI ZHANGJIANG HI-TECH PARK DEVELOPMENT CO.,LTD",600895
"LANHAI MEDICAL INVESTMENT CO., LTD.",600896
"Xiamen International Airport Co.,Ltd",600897
"Gome Telecom Equipment Co., Ltd.",600898
"China Yangtze Power Co.,ltd.",600900
"Jiangsu Financial Leasing Co.,Ltd.",600901
www.guizhougas.com,600903
"Wuxi Rural Commercial Bank Co., Ltd.",600908
"HUAAN SECURITIES CO., LTD.",600909
http://www.cqgas.cn/,600917
"BANK OF JIANGSU CO., LTD.",600919
"BANK OF HANGZHOU CO.,LTD.",600926
 ?????????? ???????? ???????????????? ?????? ?? ??????,600929
"IKD Co., Ltd.",600933
-,600936
CHONGQING CONSTRUCTION ENGINEERING GROUP CORPORATION LIMITED,600939
ORIENT SECURITIES COMPANY LIMITED,600958
Jiangsu Broadcasting Cable Information Network Corporation Limited,600959
www.bhpiston.com,600960
"ZHUZHOU SMELTER GROUP CO.,LTD.",600961
"SDIC ZHONGLU FRUIT JUICE CO.,LTD.",600962
"YUEYANG FOREST ?? PAPER CO., LTD.",600963
"Fortune Ng Fung Food (Hebei) Co., Ltd",600965
"SHANDONG  BOHUI PAPER INDUSTRIAL  CO.,LTD.",600966
www.bfcy.cc,600967
Hunan Chendian International Development Share-holding Limited company,600969
"Sinoma International Engineering Co.,Ltd.",600970
Http://www.ahhymd.com.cn,600971
"BAOSHENG SCIENCE AND TECHNOLOGY INNOVATION CO., LTD.",600973
www.newwf.com,600975
JIANMIN PHARMACEUTICAL GROUP CO.??LTD.,600976
"CHINA FILM CO., LTD.",600977
http://www.yihuatimber.com,600978
"SICHUAN GUANGAN AAA PUBLIC CO.,LTD .",600979
"BGRIMM Technology Co.,Ltd.",600980
JIANGSU HIGH HOPE INTERNATIONAL CORPORATION,600981
www.nbtp.com.cn,600982
"Whirlpool China Co.,Ltd",600983
"SHAANXI  CONSTRUCTION  MACHINERY  CO.,LTD.",600984
"Anhui Leimingkehua Co.,Ltd",600985
"KEDA GROUP CO., LTD.",600986
"ZHEJIANG HANGMIN CO., LTD.",600987
www.600988.com.cn,600988
"Anhui Sun Create Electronics Co.,Ltd",600990
"GUIZHOU WIRE ROPE CO.,LTD",600992
www.mayinglong.cn,600993
"YUNNAN WENSHAN ELECTRIC POWER CO.,LTD.",600995
http://www.gzgdwl.com/,600996
KAILUAN ENERGY CHEMICAL CORPORATION LIMITED,600997
Jointown Pharmaceutical Group Company Limited,600998
"China Merchants Securities Co.,Ltd.",600999
"TANGSHAN PORT GROUP CO.,LTD.",601000
"Datong Coal Industry Co., Ltd.",601001
"GEM-YEAR INDUSTRIAL CO.,LTD.",601002
"LIUZHOU IRON&STEEL CO.,LCD",601003
www.cqgt.cn,601005
"Daqin Railway Co., Ltd.",601006
www.jinlinghotel.com,601007
"Jiangsu Lianyungang Port Co.,Ltd.",601008
"BANK OF NANJING CO., LTD",601009
Wenfeng Great World Chain Development  Corporation,601010
"Baotailong New Materials Co., Ltd.",601011
"LONGi Green Energy Technology Co., Ltd.",601012
"Shaanxi Heimao Coking Co., Ltd ",601015
http://www.cecwpc.cn,601016
Ningbo Zhoushan Port Company Limited,601018
http://www.sdcbcm.com/,601019
-,601020
"Spring Airlines Co., Ltd.",601021
"Jiangsu Yulong Steel Pipe Co., Ltd.",601028
FIRST TRACTOR COMPANY LIMITED,601038
www.sailunjinyu.com,601058
w-r-g.cn,601069
Gansu Guofang Industry & Trade Group Limited by Share Ltd.,601086
China Shenhua Energy Company Limited,601088
"China South Publishing & Media Group Co.,Ltd.",601098
http://www.tpyzq.com,601099
jiangsu hengli hydraulic co.Ltd,601100
"BEIJING HAOHUA ENERGY RESOURCE CO. ,LTD",601101
China First Heavy lndustries,601106
http://www.cygs.com,601107
"CAITONG SECURITIES CO.,LTD",601108
Air China Limited,601111
"Yiwu Huading Nylon Co.,Ltd.",601113
sanjiang.com,601116
"China National Chemical Engineering CO.,LTD.",601117
"China Hainan Rubber Industry Group Co.,LTD.",601118
"BEIJING SIFANG AUTOMATION CO.,LTD.",601126
"CHONGQING SOKON INDUSTRY GROUP STOCK CO.,LTD.",601127
"Jiangsu Changshu Rural Commercial Bank Co., Ltd.",601128
www.pwalloy.com,601137
www.szgas.com.cn,601139
"Future Land Holdings Co., Ltd",601155
www.cncqsw.com,601158
"TRIANGLE TYRE CO., LTD.",601163
"INDUSTRIAL BANK CO.,LTD.",601166
"Western Mining Co., Ltd.",601168
"BANK OF BEIJING CO.,LTD.",601169
www.chinaadvance.com,601177
www.xdect.com.cn,601179
China Railway Construction Corporation Limited,601186
"HEILONGJIANG TRANSPORT DEVELOPMENT CO., LTD",601188
"DONGXING SECURITIES CO., LTD.",601198
www.jsjnsw.com,601199
"SHANGHAI ENVIRONMENT GROUP CO., LTD.",601200
"SICHUAN EM TECHNOLOGY CO.,LTD.",601208
Guotai Junan Securities Co. Ltd.,601211
"Baiyin Nonferrous Group Co.,Ltd",601212
"INNER MONGOLIA JUNZHENG ENERGY & CHEMICAL GROUP CO.,LTD.",601216
"Jiangsu SINOJIT Wind Energy Technology Co,.Ltd.",601218
"JIANGSU LINYANG Energy CO., LTD.",601222
SHAANXI COAL INDUSTRY COMPANY LIMITED,601225
"HUADIAN HEAVY INDUSTRIES CO.,LTD.",601226
guangzhou port company limited,601228
"Bank of Shanghai Co.,ltd.",601229
"Universal scientific industrial(shanghai)Co.,Ltd.",601231
"TONGKUN GROUP CO,LTD",601233
"GUANGZHOU AUTOMOBILE GROUP CO.,LTD.",601238
"Pang Da Automobile Trade Co., Ltd.",601258
AGRICULTURAL BANK OF CHINA LIMITED,601288
"Camel Group Co.,Ltd.",601311
"PING AN INSURANCE??GROUP?? COMPANY OF CHINA, LTD.",601318
"Qinhuangdao Port Co., Ltd.*",601326
"BANK OF COMMUNICATIONS CO.,LTD.",601328
GUANGSHEN RAILWAY COMPANY LIMITED,601333
NEW CHINA LIFE INSURANCE COMPANY LTD.,601336
"BROS EASTERN CO., LTD.",601339
www.360.cn,601360
" Liqun Commercial Group Co., Ltd. ",601366
-,601368
"XI'AN SHAANGU POWER CO., LTD.",601369
"Central China Securities Co., Ltd.",601375
"Industrial Securities Co.,Ltd",601377
Yechiu Metal Recycling (China) Ltd.,601388
www.crec.cn,601390
INDUSTRIAL AND COMMERCIAL BANK OF CHINA LIMITED,601398
"JIANGSU GENERAL SCIENCE TECHNOLOGY CO.,LTD",601500
"SHANTOU DONGFENG PRINTING CO.,LTD.",601515
Jilin Expressway Company Ltd.,601518
Shanghai DZH Limited,601519
"SOOCHOW SECURITIES CO.,LTD.",601555
www.sinovel.com,601558
www.jiumuwang.com,601566
"NINGBO SANXING MEDICAL ELECTRIC Co.,Ltd.",601567
"kuaijishan shaoxing wine co.,ltd.",601579
BEIJING NORTH STAR COMPANY LIMITED,601588
shanghai film corporation,601595
"Jiangsu Lugang Culture Co., Ltd",601599
ALUMINUM CORPORATION OF CHINA LIMITED,601600
"China Pacific Insurance (Group) Co., Ltd.",601601
"Shanghai Pharmaceuticals Holding Co., Ltd.",601607
"CITIC HEAVY INDUSTRIES CO.,LTD.",601608
CHINA NUCLEAR ENGINEERING CORPORATION LIMITED,601611
www.sgeg.cn,601616
Metallurgical Corporation of China Ltd.,601618
Ningxia Jiaze Renewables Corporation Limited,601619
CHINA LIFE INSURANCE COMPANY LIMITED,601628
Great Wall Motor Company Limited,601633
"Zhuzhou Kibing Group Co., Ltd",601636
"PINGDINGSHAN TIANAN COAL MINING CO., LTD.",601666
China State Construction Engineering Corporation Limited,601668
"Power Construction Corporation of China,Ltd.??POWERCHINA Ltd.??",601669
"Henan Mingtai Al. Industrial Co.,Ltd.",601677
"BEFAR GROUP CO.,LTD",601678
"HUATAI SECURITIES CO.,LTD",601688
"Ningbo Tuopu Group Co.,Ltd.",601689
"Shanxi Lu??an Environmental Energy Development Co.,Ltd.",601699
"CHANGSHU FENGFAN POWER EQUIPMENT CO.,LTD",601700
www.zzmj.com,601717
Jihua Group Corporation Limited,601718
www.shanghai-electric.com,601727
CRRC Corporation Limited,601766
"LIFAN INDUSTRY (GROUP) Co., Ltd",601777
Everbright Securities Company Limited,601788
"Ningbo Construction Co., Ltd",601789
Lanpec Technologies Limited,601798
"Changzhou Xingyu Automotive Lighting Systems Co., Ltd",601799
"China Communications Construction Co.,Ltd",601800
"ANHUI XINHUA MEDIA CO., LTD",601801
China Oilfield Services Limited,601808
http://www.winshare.com.cn,601811
CHINA EVERBRIGHT BANK COMPANY LIMITED,601818
www.chinaredstar.com,601828
"BANK OF CHENGDU CO., LTD.",601838
PetroChina Company Limited,601857
China Science Publishing & Media Ltd.,601858
"COSCO SHIPPING Development Co.,Ltd.",601866
"CHINA MERCHANTS ENERGY SHIPPING CO., LTD.",601872
www.chint.net,601877
-,601878
Dalian Port (PDA) Company Limited,601880
"China Galaxy Securities Co., Ltd.",601881
"NINGBO HAITIAN PRECISION MACHINERY CO., LTD.",601882
"Jangho  Group Co., Ltd.",601886
China lnternationnal Travel Service Corporation Limited,601888
"Asian Star Anchor Chain Co.,Ltd.Jiangsu",601890
China Coal Energy Company Limited,601898
Zijin Mining Group Company Limited,601899
Southern Publishing and Media Company Limited,601900
"Founder Securities Co., Ltd.",601901
"Beijing Jingyuntong Technology Co.,Ltd.",601908
"CHINA COAL XINJI ENERGY CO.,LTD",601918
"COSCO SHIPPING Holdings Co., Ltd.",601919
JIANGSU PHOENIX PUBLISHING&MEDIA CORPORATION LIMITED,601928
"JISHI MEDIA CO., LTD.",601929
"YONGHUI SUPERSTORES CO., LTD.",601933
CHINA CONSTRUCTION BANK CORPORATION,601939
www.cnpubc.com,601949
"Jiangsu Provincial Agricultural Reclamation and Development Co.,Ltd",601952
"Jinduicheng Molybdenum Co.,Ltd",601958
"CHINA AUTOMOTIVE ENGINEERING RESEARCH INSTITUE CO.,LTD",601965
"Shandong Linglong Tyre Co.,Ltd",601966
"Shanghai Baosteel Packaging Co.,Ltd",601968
"Hainan Mining Co.,Ltd",601969
www.cnnp.com.cn,601985
BANK OF CHINA LIMITED,601988
China Shipbuilding Industry Company Limited,601989
www.dtpower.com,601991
BBMG Corporation,601992
"Guangxi Fenglin Wood lndustry Group Co.,Ltd.",601996
BANK OF GUIYANG CO.LTD.,601997
CHINA CITIC BANK CORPORATION LIMITED,601998
Northern United Publishing & Media ??Group?? Company Limited,601999
www.people.com.cn,603000
"ZheJiang AoKang Shoes Co., Ltd.",603001
EPOXY BASE ELECTRONIC MATERIAL  CORPORATION LIMITED,603002
"SHANGHAI LONYER FUELS CO., LTD",603003
"China Wafer Level CSP Co., Ltd",603005
"Shanghai Lianming Machinery Co.,Ltd",603006
Flower King Eco-Engineering Inc.,603007
"XILINMEN FURNITURE CO.,LTD.",603008
"SHANGHAI BEITE TECHNOLOGY CO.,LTD.",603009
"Zhejiang Wansheng Co.,Ltd",603010
"Hefei Metalforming Intelligent Manufacturing Co., Ltd.",603011
"Shanghai Chuangli Group CO.,LTD.",603012
"Ningbo Techmation Co.,Ltd.",603015
"Wuxi New Hongtai Electrical Technology Co.,Ltd",603016
"ARTS Group Co., Ltd",603017
"China DesignGroupCo.,Ltd.",603018
www.sugon.com,603019
"Apple Flavor & Fragrance Group Co., Ltd",603020
http://www.huapengglass.com,603021
"SHANGHAI XINTONGLIAN PACKINF CO.,LTD",603022
Harbin VITI Electronics Corp,603023
-,603025
"SHANDONG SHIDA SHENGHUA CHEMICAL GROUP CO.,LTD",603026
"QIANHE CONDIMENT AND FOOD CO., LTD",603027
http://www.wxrope.com/,603028
"ShanDong Swan Cotton Industrial Machinery Stock Co., Ltd.",603029
"Shanghai Trendzone Consturction Decoration Group Co.,Ltd",603030
http://www.sinoadl.com/,603031
"DELIXI XINJIANG Transportation Co.,Ltd.",603032
"Zhejiang Sanwei Rubber Item Co.,Ltd ",603033
"Changshu Automotive Trim co.,Ltd.",603035
"JIANGSU RUTONG PETRO-MACHINERY CO., LTD.",603036
"Shanghai Carthane Co., LTD",603037
"HUALI INDUSTRIES CO.,LTD.",603038
www.weaver.com.cn,603039
www.xzbco.com,603040
"Jiangsu Maysta Chemical Co., Ltd",603041
Nanjing Huamai Technology CO.;Ltd.,603042
"GUANGZHOU RESTAURANT GROUP CO.,LTD.",603043
http://www.kldcop.com,603050
"ZHE JIANG TAIHUA NEW MATERIAL CO., LTD.",603055
"DEPPON LOGISTICS Co.,LTD.",603056
"Gui zhou Yongji Printing Co.,ltd",603058
http:// www.toothbrush.com.cn/,603059
"China Building Material Test & Certification Group Co., Ltd.",603060
??????????????????????????1??,603063
http://www.informrack.com/,603066
"Hubei ZhenHua Chemical Co., LTD",603067
"Hainan Haiqi Transportation Group Co.,Ltd.",603069
"Ningbo Lehui International Engineering Equipment Co.,Ltd.",603076
www.hebang.cn,603077
"Jiangyin Jianghuamicro Elctronic Materials Co.,Ltd",603078
http://www.sd-pharm.com/main.html,603079
www.xjhjrq.com,603080
"ZHEJIANG DAFENG INDUSTRIAL CO., LTD",603081
"CIG SHANGHAI CO.,LTD.",603083
"Zhejiang Tiancheng Controls Co.,Ltd",603085
"SHANDONG CYNDA CHEMICAL CO.,LTD",603086
www.nbjingda.com,603088
"ADD Industry??Zhejiang?? CO., LTD",603089
-,603090
http://www.readinglife.com/,603096
CENTER INTERNATIONAL GROUP COMPANY LIMITED,603098
changbai shan tourism company limited,603099
"Chongqing Chuanyi Automation Co.,LTD",603100
www.wuikatimes.com,603101
"Hengdian Entertainment CO.,LTD",603103
"Cashway Technology Co.,Ltd.",603106
"Shanghai Runda Medical Technology Co.,Ltd",603108
"New East New Materials Co., Ltd",603110
www.kn-nanjing.com,603111
"JINNENG SCIENCE&TECHNOLOGY CO., LTD.",603113
-,603116
-,603117
"SHENZHEN GONGJIN ELECTRONICS CO.,LTD.",603118
"Beijing Cuiwei Tower Co.,Ltd.",603123
Sinoma Energy Conservation Ltd.,603126
"JOINN LABORATORIES (CHINA) CO., LTD",603127
http://www.ctsfreight.com,603128
"ZHEJIANG CFMOTO POWER CO.,LTD.",603129
"SHANGHAI HUGONG ELECTRIC GROUP CO.,LTD",603131
"Tanyuan??Technology??Co.,??Ltd. ",603133
"Jiangsu Tianmu Lake Tourism Co.,Ltd",603136
"Beijing Vastdata Technology Co., Ltd.",603138
"SHAANXI KANGHUI PHARMACEUTICAL CO.,LTD",603139
"Hebei Yangyuan Zhihui Beverage Co.,Ltd.",603156
http://www.lachapelle.cn,603157
"Changzhou Tenglong Auto Parts Co.,Ltd.",603158
-,603159
"Shenzhen Goodix Technology Co.,Ltd.",603160
"Kehua Holdings Co., Ltd.",603161
"Zhejiang Rongsheng Environmental Protection Paper Co.,LTD",603165
"GUI LIN FUDA CO.,LTD",603166
"Bohai Ferry GROUP Co.,Ltd.",603167
"Zhejiang Shapuaisi Pharmaceutical Co., Ltd.",603168
"Lanzhou LS Heavy Equipment co., Ltd",603169
"zhejiang tuna environmental science & technology co., ltd",603177
"Ningbo Shenglong Automotive PowertrainSystem Co.,Ltd.",603178
"Jiangsu Xinquan Automotive Trim Co.,Ltd",603179
http://www.goldenhome.cc,603180
"Zhejiang Huangma Technology Co.,Ltd.",603181
"SUZHOU INSTITUTE OF BUILDING SCIENCE GROUP CO.,LTD",603183
"Zhejiang Huazheng New Material  Co., Ltd.",603186
"Jiangsu Yabang Dyestuff Co.,Ltd.",603188
"Shanghai Wondertek Software Co.,Ltd",603189
"Ribo Fashion Group Co., Ltd.",603196
Shanghai Baolong Automotive Corporation,603197
ANHUI YINGJIA DISTILLERY CO.??LID.,603198
"Anhui Jiuhuashan Tourism Development Co., Ltd.",603199
"Shanghai Emperor Of Cleaning Hi-Tech Co., LTD.",603200
"QUICK INTELLIGENT EQUIPMENT CO.,LTD.",603203
"Jiangshan Oupai Door Industry Co., Ltd",603208
"Shanghai Aiyingshi Co.,Ltd",603214
"Riyue Heavy Industry Co.,Ltd",603218
"Zhejiang Chimin Pharmaceutical CO,LTD",603222
"HENGTONG LOGISTICS CO.,LTD.",603223
http://xfmgroup.com/,603225
www.vohringer.com,603226
"Xinjiang Xuefeng Sci-Tech(Group)Co.,Ltd.",603227
"Shenzhen Kinwong Electronic Co.,Ltd.",603228
"Zhejiang Ausun Pharmaceutical Co., Ltd.",603229
"SHANGHAI KOAL SOFTWARE CO.,LTD.",603232
"DaShenLin Pharmaceutical Group Co., Ltd.",603233
"HangZhou??Nbond??Nonwovens??Co.,??Ltd.",603238
"ZHEJIANG XIANTONG RUBBER & PLASTIC CO.,LTD",603239
www.dianhun.cn,603258
"Hoshine Silicon Industry Co., Ltd.",603260
"Ningbo Tianlong Electronics Co., Ltd.",603266
"GUANGDONG SONGFA CERAMICS CO., LTD.",603268
"Jiangsu Seagull Cooling Tower Co.,Ltd.",603269
"YINDU KITCHEN EQUIPMENT CO., LTD",603277
-,603278
"Suzhou Secote Precision Electronic Co., Ltd. ",603283
"JIANGSU RIYING ELECTRONICS CO.,LTD.",603286
Foshan Haitian Flavouring and Food Company Ltd.,603288
http://cn.tederic-cn.com,603289
"HANGCHA GROUP.,LTD.",603298
"Jiang Su Jingshen Salt & Chemical Industry Co.,Ltd",603299
"Zhejiang Huatie Construction Safety Science And Technology Co.,Ltd.",603300
-,603301
http://www.tospolighting.com.cn,603303
-,603305
"HMT(XIAMEN) NEW TECHNICAL MATERIALS CO.,LTD.",603306
"ANHUI YINGLIU ELECTROMECHANICAL CO.,LTD",603308
"WELL LEAD MEDICAL CO., LTD.  ",603309
"Zhejiang Goldensea Environment Technology Co.,Ltd",603311
"Healthcare Co.,Ltd",603313
"LIAONING FU-AN HEAVY INDUSTRY CO., LTD",603315
"Zhejiang Chengbang Landscape Co., Ltd",603316
"DALIAN ENERGAS GAS-SYSTEM CO.,LTD.",603318
"HUNAN OIL PUMP Co., Ltd.",603319
www.dibei.com,603320
"ZHE JIANG MEI LUN ELEVATOR CO.,LTD",603321
"GUANGDONG SUPER TELECOM CO.,LTD.",603322
"JIANGSU WUJIANG RURAL COMMERCIAL BANK CO., LTD",603323
Nanjing OLO Home Furnishing INC.,603326
"Guangdong Ellington Electronics Technology Co., Ltd.",603328
"SHANGHAI ACE INVESTMENT&DEVELOPMENT CO., LTD.",603329
http://www.hotmelt.com.cn/,603330
Zhejiang Baida Precision Manufacturing Corp. ,603331
"SICHUAN STAR CABLE CO.,LTD",603333
Guangdong Dcenti Auto-Parts Stock Limited Company,603335
"GREAT-SUN FOODS CO.,LTD.",603336
JACK SEWING MACHINE CO.??LTD,603337
"Zhejiang Dingli Machinery Co.,Ltd",603338
Nantong Square Cold Chain Equipment Co.??Ltd.,603339
"FUJIAN ANJOY FOODS CO.,LTD",603345
www.lexy.cn,603355
"Xuancheng Valin Precision Technology Co., Ltd.",603356
"Anhui Transport Consulting & Design Institute Co.,Ltd.",603357
"Huada Automotive Technology Corp.,Ltd",603358
-,603359
"DalianBio-ChemCo.,Ltd.",603360
www.aonong.com.cn,603363
"Shanghai Shuixing Home Textile Co., Ltd.",603365
"Jiangsu Sunrain Solar Energy Co.,Ltd",603366
"CISEN PHARMACEUTICAL CO., LTD.",603367
"Guangxi Liuzhou Pharmaceutical Co.,Ltd.",603368
"Jiangsu King??s Luck Brewery Joint ? Stock Co., Ltd",603369
"Eastern Pioneer Driving School Co., Ltd.",603377
"ASIA CUANON TECHNOLOGY(SHANGHAI)CO.,LTD.",603378
www.etron.cn,603380
"Fujian Apex Software Co.,LTD",603383
"HUIDA SANITARY WARE CO.,LTD.",603385
"Guangdong Champion Asia Electronics CO.,LTD.",603386
http://www.bio-gp.com.cn,603387
"Yuancheng Environment Co., Ltd.",603388
A-Zenith Home Furnishings Co.?? Ltd.,603389
-,603393
"YINGKOU JINCHEN MACHINERY CO., LTD. ",603396
"BanBao Co., Ltd.",603398
"JINZHOU JIXIANG MOLYBDENUM CO.,LTD",603399
www.xinje.com,603416
Qingdao Topscomm Communication INC.,603421
"Anhui Genuine New Materials Co.,Ltd.",603429
"G-bits Network Technology(Xiamen)Co., Ltd",603444
"ZHEJIANG  JIUZHOU   PHARMACEUTICAL  CO.,LTD",603456
"Guizhou Transportation Planning Survey&Design Academe Co.,Ltd.",603458
-,603466
"Sichuan Zhenjing Co., Ltd.",603477
"FLYING TECHNOLOGY CO.,LTD",603488
EmbedWay Technologies (Shanghai) Corporation ,603496
"Shanghai Sunglow Packaging Technology Co., Ltd",603499
"Zhejiang Tiantai Xianghe Industrial Co., Ltd.",603500
"Will Semiconductor CO., Ltd. Shanghai",603501
"China Kings Resources Group Co., Ltd.",603505
"Nacity Property Service Co., Ltd.",603506
-,603507
"Henan Thinker Automatic Equipment Co.,Ltd",603508
http://www.opple.com.cn/,603515
"Beijing Tricolor Technology Co., Ltd.",603516
-,603517
"V.GRASS FASHION CO.,LTD.",603518
"JIANGSU LIBA ENTERPRISE JOINT-STOCK CO., LTD",603519
"Zhejiang Starry Pharmaceutical CO.,LTD",603520
"Anhui Zhongyuan New Materials Co.,Ltd.",603527
DUOLUN TECHNOLOGY CORPORATION LTD.,603528
-,603533
-,603535
"Shandong Huifa Foodstuff Co.,Ltd.",603536
"Ningbo Menovo Pharmaceutical Co., Ltd.",603538
-,603555
"Hexing Electrical Co.,Ltd",603556
Qibu Corporation Limited,603557
"Zhejiang Jasan Holding Group co.,Ltd",603558
www.ztgmcom.com,603559
PULIKE BIOLOGICAL ENGINEERING??INC.,603566
"HeiLongJiang ZBD Pharmaceutical Co., Ltd.",603567
"ZHEJIANG WEIMING ENVIRONMENT PROTECTION CO.,LTD.",603568
http://www.changjiulogistics.com,603569
"QINGDAO HUIJINTONG POWER EQUIPMENT CO., LTD.",603577
"Zhejiang Three Stars New Materials Co.,Ltd.",603578
Shanghai Rongtai Health Technology Corporation Limited,603579
"AA INDUSTRIAL BELTING (SHANGHAI) CO., LTD",603580
"Suli Co.,Ltd.",603585
www.chinabrake.com,603586
"Beijing GeoEnviron Engineering & Technology, Inc.",603588
"Anhui Kouzi Distillery Co., Ltd.",603589
"zhejiang tony electronic co., ltd",603595
"Inly Media Co., Ltd.",603598
"Anhui Guangxin Agrochemical Co., Ltd. ",603599
"UE Furniture Co., Ltd.",603600
Chongqing Zaisheng Technology Corp. Ltd,603601
"Hangzhou Freely Communication Co., Ltd",603602
"Poten Environment Group Co., Ltd.",603603
"Proya Cosmetics Co.,LTD",603605
"NINGBO ORIENT WIRES & CABLES CO., LTD.",603606
http://www.sx-jhjg.com,603607
"TOPSCORE FASHION SHOES CO., LTD.",603608
"Wellhope Agri-Tech Joint Stock Co., Ltd. ",603609
"NOBLELIFT INTELLIGENT EQUIPMENT CO.,LTD.",603611
"Sunstone Development Co.,Ltd",603612
"Chahua Modern Housewares Co.,Ltd.",603615
Beijing Hanjian Heshan Pipeline Co.Ltd,603616
"JUNHE PUMPS HOLDING CO.,LTD",603617
"Hangzhou Cable Co., Ltd.",603618
Zhongman Petroleum and Natural Gas Group Corp.??Ltd,603619
"KunshanKersen Science & Technology Co.,Ltd.",603626
"CLENERGY (XIAMEN)TECHNOLOGY PTY., LTD",603628
"Lafang China Co.,Ltd",603630
"Shanghai Laimu Electronics Co.,Ltd",603633
"Linewell Software Co.,Ltd.",603636
"ZHENHAI PETROCHEMICAL ENGINEERING CO., LTD.",603637
"YANTAI EDDIE PRECISION MACHINERY CO.,LTD",603638
http://www.hailir.cn,603639
