Company name,Symbol
"Shanghai Shine-Link International Logistics Co., Ltd.",603648
-,603655
http://chinataiho.com/,603656
www.autobio.com.cn,603658
"Shanghai Putailai New Energy Technology Co., Ltd.",603659
-,603660
"Zhejiang Henglin Chair Industry Co.,Ltd.",603661
"SANXIANG ADVANCED MATERIALS CO.,LTD.",603663
http://www.kanglongda.com.cn,603665
"Zhejiang XCC Group Co.,Ltd;",603667
"FUJIAN TIANMA SCIENCE AND TECHNOLOGY GROUP CO., LTD",603668
"Lionco Pharmaceutical Group Co.,Ltd.",603669
"Tibet Weixinkang Medicine Co., Ltd",603676
"Qijing Machinery Co., Ltd.",603677
"FUJIAN TORCH ELECTRON TECHNOLOGY Co., LTD.",603678
"Sichuan Huati Lighting Technology Co., Ltd.",603679
"KTK Group Co., Ltd. ",603680
"SHANGHAI SMITH ADHESIVE NEW MATERIAL CO.,LTD",603683
-,603685
"Fujian Longma Environmental Sanitation Equipment CO., LTD.",603686
"JIANGSU PACIFIC QUARTZ CO.,LTD.",603688
www.ahtrq.com,603689
"PNC Process Systems Co.,Ltd",603690
"ANJI FOODSTUFF CO., LTD",603696
"changzheng Engineering Co.,LTD",603698
"Neway Valve (Suzhou) Co., Ltd.",603699
"Zhejiang Dehong Automotive Electronic & Electrical Co., Ltd.",603701
"Zhejiang Shengyang Science and Technology Co.,Ltd.",603703
"Nanjing King-friend Biochemical Pharmaceutical Co.,Ltd.",603707
"Jiajiayue Group Co., Ltd.",603708
" ZOY Home Furnishing Co., Ltd.",603709
-,603711
"Tianjin 712 Communication & Broadcasting Co.,Ltd",603712
Wuhan??Thalys??Medical??Technology??Inc.,603716
"Tianyu Eco-Environment Co.,Ltd.",603717
www.hile-bio.com,603718
-,603721
"Wuxi Acryl Technology CO.,LTD",603722
"Guangdong Tianan New Material Co., Ltd.",603725
"Zhejiang Langdi Group Co., Ltd.",603726
BOMESC Offshore Engineering Company Limited,603727
www.moons.com.cn,603728
"Shanghai LongYun Advertising & Media Co.,Ltd.",603729
"Shanghai Daimay Automotive Interior Co., Ltd.",603730
http://www.skshu.com.cn,603737
Hubei TKD Crystal Electronic Science and Technology Co.??Ltd.,603738
"Zhejiang Dayuan Pumps Industry Co., Ltd",603757
CHONGQING QIN'AN M&E PLC.,603758
"Loncin Motor Co.,Ltd.",603766
"ZHEJIANG ZOMAX TRANSMISSION CO.,LTD.",603767
Hefei Changqing Machinery Company Limited ,603768
-,603776
"Shanghai Laiyifen Co., Ltd.",603777
"Beijing Qianjing Landscape Co., Ltd.",603778
"WEILONG GRAPE WINE CO., LTD.",603779
"JIANGSU XINRI E-VEHICLE CO., LTD.",603787
Ningbo Gaofa Automotive Control System Co. LTD,603788
http://www.xg1688.com/,603789
"Guangdong Liantai Environmental Protection Co.,Ltd. ",603797
QINGDAO COPTON TECHNOLOGY COMPANY LIMITED,603798
"ZHEJIANG HUAYOU COBALT CO., LTD.",603799
"SUZHOU DOUSON DRILLING & PRODUCTION EQUIPMENT CO., LTD",603800
"ZBOM CABINETS CO.,LTD.",603801
www.raisecom.com,603803
"HANGZHOU FIRST APPLIED MATERIAL CO., LTD.",603806
"Shenzhen Ellassay Fashion Co.,Ltd.",603808
"CHENGDU HAONENG TECHNOLOGY CO., LTD.",603809
"ZHEJIANG CHENG YI PHARMACEUTICAL CO.,LTD.",603811
"GuangDong GenSho Logistics Co.,LTD",603813
"Jason Furniture??Hangzhou??Co.,Ltd.",603816
"Fujian Haixia Environmental Protection Group Co.,Ltd.",603817
"QuMei Home Furnishings Group Co., Ltd",603818
Changzhou Shenli Electrical Machine Incorporated Company,603819
"ZHE JIANG JIAAO ENPROTECH STOCK CO., LTD",603822
"LILY GROUP CO.,LTD",603823
"Hylink Digital Solution Co.,Ltd",603825
"FUJIAN KUNCAI MATERIAL TECHNOLOGY CO.,LTD",603826
www.kldzs.com,603828
-,603829
Oppein Home Group Inc.,603833
"GUANGDNG SITONG GROUP CO.,LTD",603838
"Anzheng Fashion Group Co.,Ltd",603839
"Zhengping Road & Bridge Construction Co., Ltd.",603843
"Guangdong Hotata Technology Group  co., Ltd. ",603848
-,603855
-,603856
"Shandong Buchang Pharmaceuticals Co., Ltd",603858
"Nancal Energy-Saving Technology Co.,Ltd.",603859
-,603860
www.bydq.com,603861
www.tolybread.cn,603866
www.flyco.com,603868
Beibu Gulf Tourism Corporation Limited,603869
"JIA YOU INTERNATIONAL LOGISTICS CO., LTD",603871
www.peacebird.com,603877
www.wjss.com.cn,603878
"YONGYUE SCIENCE&TECHNOLOGY CO.,LTD",603879
"Jiangsu Nanfang Medical Co.,Ltd.",603880
"Shanghai Athub Co.,Ltd.",603881
"Guangzhou Kingmed Diagnostics Group Co., Ltd.",603882
LBX Pharmacy Chain Joint Stock Company,603883
"JUNEYAO AIRLINES Co., Ltd",603885
"Ganso Co., Ltd",603886
-,603887
www.xinhuanet.com??www.news.cn,603888
Zhejiang Xinao Textiles Inc.,603889
"Suzhou Chunqiu Electronic Technology Co., LTD",603890
"Shanghai Tianyong Engineering Co.,Ltd",603895
"Zhejiang Shouxiangu Pharmaceutical Co., Ltd.",603896
"ZHEJIANG GRANDWALL ELECTRIC SCIENCE&TECHNOLOGY CO.,LTD.",603897
"Guangzhou Holike Creative Home Co.,Ltd.",603898
Shanghai M&G Stationery Inc. ,603899
www.tesiro.com,603900
"Hangzhou Youngsun Intelligent Equipment Co., Ltd.",603901
"CSD Water Service Co, Ltd.",603903
"JIANGSU LOPAL TECH. Co., Ltd.",603906
"COMEFLY OUTDOOR CO.,LTD",603908
"HOLSIN ENGINEERING CONSULTING GROUP CO.,LTD.",603909
"Nanjing Canatal Data-Centre Environmental Tech Co., Ltd",603912
"SOBUTE NEW MATERIALS CO., LTD",603916
"Ningbo Heli Mould Technology Shareholding Co., Ltd.",603917
"Shanghai Golden Bridge InfoTech Co.,Ltd. ",603918
"JINHUI LIQUOR Co.,Ltd.",603919
"OLYMPIC CIRCUIT TECHNOLOGY CO.,LTD",603920
"Suzhou Jinhongshun Auto Parts Co., LTD.",603922
"ZHEJIANG TIELIU CLUTCH CO.,LTD.",603926
"Suzhou Xingye Materials Technology Co.,Ltd.",603928
"L&K ENGINEERING(SUZHOU)CO.,LTD.",603929
"FUJIAN RAYNEN TECHNOLOGY CO.,LTD",603933
"BOMIN ELECTRONICS CO., LTD.",603936
"JIANGSU LIDAO NEW MATERIAL CO., LTD.",603937
"Tangshan Sunfar Silicon Industries Co., Ltd",603938
"Yifeng Pharmacy Chain Co., Ltd.",603939
"DAQIAN ECOLOGY & ENVIRONMENT GROUP CO., LTD",603955
"HARSON TARDING (CHINA) CO.,LTD.",603958
" HUNAN BAILI ENGINEERING SCI&TECH CO.,LTD",603959
http://www.sh-kelai.com/,603960
"Dali Pharmaceutical Co.,Ltd.",603963
"Eurocrane (China) Co.,Ltd.",603966
"Nan  Tong  Acetic  Acid  Co.,   Ltd. ",603968
"SILVERY DRAGON PRESTRESSED MATERIALS CO., LTD. TIANJIN",603969
"SINO-AGRI  LEADING  BIOSCIENCES  CO.,LTD.",603970
"ChongQing Zhengchuan Pharmaceutical Packaging Co.,Ltd.",603976
"Jiangxi Guotai Industrial Explosive Group Co., Ltd.",603977
"SHENZHEN SUNXING LIGHT ALLOYS MATERIALS CO.,LTD.",603978
"JCHX MINING MANAGEMENT CO.,LTD.",603979
"ZheJiang JiHua Group Co.,Ltd",603980
"Jiangyin Hengrun Heavy Industries Co.,Ltd",603985
GigaDevice Semiconductor(Beijing) Inc,603986
"Shanghai Kindly Enterprise Development Group Co.,Ltd.",603987
www.sec-motor.com,603988
"HUNAN AIHUA GROUP C0.,LTD.",603989
"Suzhou MedicalSystem Technology Co., Ltd.",603990
"Shanghai Originaldow Advanced Compounds Co., Ltd",603991
"China Molybdenum Co., Ltd.",603993
"CHUNGHSIN TECHNOLOGY GROUP CO., LTD",603996
"NINGBO JIFENG AUTO PARTS CO.,LTD",603997
"Hunan Fangsheng Pharmaceutical Co., Ltd.",603998
"DuZhe Publishing&Media Co.,Ltd.",603999
INESA Intelligent Tech Inc.,900901
"SHANGHAI SHIBEI HI-TECH CO.,LTD.",900902
"DAZHONG TRANSPORTATION??GROUP??CO.,LTD.",900903
"Shanghai Shenqi Pharmaceutical Investment Management Co., Ltd.",900904
"LAO FENG XIANG CO.,LTD.",900905
"Shang Hai Zhong Yi Da Co.,Ltd",900906
"PENGQI TECHNOLOGY DEVELOPMENT  CO.,LTD",900907
"SHANGHAI CHLOR-ALKALI CHEMICAL CO.,LTD.",900908
SHANGHAI HUAYI GROUP CORPORATION  LTD.,900909
"SHANGHAI HIGHLY(GROUP) CO.,LTD.",900910
"Shanghai Jinqiao Export Processing Zone Development Co.,Ltd.",900911
"SHANGHAI WAI GAOQIAO FREE TRADE ZONE DEVELOPMENT CO.,LTD.",900912
SHANXI GUOXIN ENERGY CORPORATION LIMITED,900913
"Shanghai Jin Jiang International Industrial Investment Co.,Ltd",900914
"ZHONGLU CO,.LTD.",900915
"ShangHai Phoenix Enterprise (Group) CO., LTD.",900916
"SHANGHAI HAIXIN GROUP CO., LTD.",900917
"SHANGHAI YAOHUA PILKINGTON GLASS GROUP CO,LTD.",900918
"Shanghai Greencourt Investment Group Co., Ltd.",900919
SHANGHAI DIESEL ENGINE COMPANY LIMITED,900920
"DANHUA CHEMICAL TECHNOLOGY CO., LTD.",900921
SHANGHAI SANMAO ENTERPRISE (GROUP) CO.??LTD.,900922
"SHANGHAI BAILIAN GROUP CO., LTD.",900923
"Shang Gong Group Co., Ltd.",900924
"Shanghai Mechanical & Electrical Industry CO., LTD.",900925
"Shanghai Baosight Software Co., Ltd.",900926
"Shanghai Material Trading Co., Ltd.",900927
Shanghai Lingang Holdings Corporation Limited,900928
"Shanghai Jinjiang International Travel Co., Ltd",900929
"SHANGHAI POTEVIO CO.,LTD.",900930
"Shanghai Lujiazui Finance & Trade Zone Development Co.,Ltd.",900932
"HUAXIN  CEMENT  CO.,  LTD.",900933
"Shanghai Jin Jiang International Hotels Development Co.,Ltd.",900934
"SHANGHAI YOUNG SUN INVESTMENT CO,LTD",900935
"Inner Mongolia Eerduosi Resources Co.,Ltd.",900936
Huadian Energy Company Limited,900937
"TIANJIN TIANHAI INVESTMENT CO., LTD.",900938
"Shanghai Huili Building Materials Co., Ltd.",900939
GREATTOWN HOLDINGS LTD.,900940
"EASTERN COMMUNICATIONS CO.,LTD.",900941
"Huangshan Tourism Development Co.,Ltd.",900942
"SHANGHAI KAI KAI INDUSTRIAL CO.,LTD.",900943
Hainan Airlines Holding Company Limited,900945
"HUNAN TYEN MACHINERY CO., LTD",900946
"SHANGHAI ZHENHUA HEAVY INDUSTRIES CO.,LTD.",900947
INNER MONGOLIA YITAI COAL COMPANY LIMITED,900948
"Jiangsu Future Land Co.,Ltd.",900950
"DAHUA GROUP DALIAN CHEMICAL INDUSTRY CO.,LTD.",900951
"JINZHOU PORT CO.,LTD.",900952
"KAMA CO., LTD.",900953
"HNA INNOVATION CO.,LTD.",900955
"HUANGSHI DONGBEI ELECTRICAL APPLIANCE CO.,LTD",900956
"SHANGHAI LINGYUN INDUSTRIES DEVELOPMENT  CO., LTD.",900957
